{
  "activation_effect": false,
  "authority_effect": false,
  "custody_reference": "master-records/orchestration:contracts/va-privacy-event-custody.json",
  "direct_identifier_replacement_count": 7,
  "execution_class": "CONTROLLED_PRODUCTION_EQUIVALENT",
  "manifest_bound_to_original_and_redacted_hashes": true,
  "model_release_allowed": true,
  "original_document_sha256": "52e32e0ebabf121949bdf77ce6cab473beb2f214e353c45a8ed690aa38e288a6",
  "page_region_anchors_present": true,
  "private_document_upload_enabled": false,
  "processor_commit_sha": "e9ed5158eb2584c2a6023902f62da2c7203ef6bb",
  "processor_path": "scripts/process_va_private_document_privacy_preprocessor.py",
  "pseudonymous_document_token": "vacc-doc-0bce3dca83e4ef3f1f939235",
  "raw_document_left_privacy_zone": false,
  "raw_pii_present_in_working_copy": false,
  "redacted_document_sha256": "1df3ce2ae98f872d73adede08aa3eb9dafcab0dc584d00bfd3c34dc2150203d3",
  "redaction_manifest_sha256": "9eeb2afede9c47e52ebe2d8baf69d308b93146ae8dd29da2663b46423a313d2a",
  "runtime_class": "ADMITTED_PRIVATE_DOCUMENT_PREPROCESSOR",
  "schema_version": "1.0.0",
  "state": "PASS",
  "task_id": "PII-RDY-02",
  "token_is_non_global": true,
  "token_is_purpose_limited": true
}
